{
  "$schema": "https://github.com/AlisinaDevelo/CARTOGRAPH/schema/workspace-federation-evaluation.v0.1.schema.json",
  "schemaVersion": 1,
  "contract": "cartograph.workspace-federation-evaluation",
  "mediaType": "application/vnd.cartograph.workspace-federation-evaluation+json",
  "evaluationId": "w006-v0.1",
  "reviewedAt": "2026-08-26T06:00:00Z",
  "tool": {
    "version": "0.1.0",
    "commit": "3ed6340a",
    "runtime": "Node.js 26.7.0",
    "platform": "darwin",
    "architecture": "arm64"
  },
  "method": {
    "replayMode": "aggregate-fixture",
    "rerunnable": true,
    "command": "npm run workspace:federation:evaluation:validate",
    "network": false,
    "sourceBodiesIncluded": false,
    "credentialsUsed": false,
    "hiddenTelemetry": false,
    "userDataIncluded": false,
    "sourceAcquisition": "not-run",
    "limitations": [
      "Replay validates pinned aggregate records and scenario metadata; it does not fetch repositories or rerun a live scan.",
      "The portfolios are public or sanitized technical records, not a statistically representative population sample.",
      "Reviewer usefulness is not observed because no external reviewer study or user telemetry is collected.",
      "Timing values are bounded fixture measurements and do not establish performance across arbitrary portfolios."
    ]
  },
  "portfolios": [
    {
      "id": "atlas",
      "title": "Atlas package, service, and schema portfolio",
      "source": {
        "kind": "sanitized-record",
        "reference": "sanitized://cartograph/atlas-portfolio",
        "revision": "a1b2c3d4",
        "license": "MIT",
        "sourceBodiesIncluded": false
      },
      "sizeTier": "small",
      "declaredSize": {
        "repositories": 4,
        "graphNodes": 44,
        "graphEdges": 64
      },
      "repositories": [
        {
          "id": "atlas-core",
          "role": "package",
          "status": "present",
          "identity": "github.com/example/atlas-core",
          "version": "1.2.0",
          "revision": "a2b3c4d5",
          "graphNodes": 18,
          "graphEdges": 24,
          "sourceBodiesIncluded": false
        },
        {
          "id": "atlas-api",
          "role": "service",
          "status": "present",
          "identity": "github.com/example/atlas-api",
          "version": "2.0.0",
          "revision": "b3c4d5e6",
          "graphNodes": 16,
          "graphEdges": 28,
          "sourceBodiesIncluded": false
        },
        {
          "id": "atlas-schema",
          "role": "schema",
          "status": "present",
          "identity": "github.com/example/atlas-schema",
          "version": "3.1.0",
          "revision": "c4d5e6f7",
          "graphNodes": 10,
          "graphEdges": 12,
          "sourceBodiesIncluded": false
        },
        {
          "id": "atlas-optional",
          "role": "package",
          "status": "missing",
          "identity": "github.com/example/atlas-optional",
          "version": null,
          "revision": null,
          "graphNodes": 0,
          "graphEdges": 0,
          "sourceBodiesIncluded": false
        }
      ],
      "scenarios": [
        {
          "id": "atlas-package",
          "kind": "package",
          "description": "A package import resolves to the pinned package namespace and carries aggregate evidence.",
          "expected": { "state": "resolved", "count": 4 },
          "observed": { "state": "resolved", "count": 4 },
          "evidenceRef": "fixture:w006-v0.1/atlas/package",
          "reproducible": true
        },
        {
          "id": "atlas-service",
          "kind": "service",
          "description": "A service declaration resolves to the pinned API repository without source execution.",
          "expected": { "state": "resolved", "count": 3 },
          "observed": { "state": "resolved", "count": 3 },
          "evidenceRef": "fixture:w006-v0.1/atlas/service",
          "reproducible": true
        },
        {
          "id": "atlas-schema",
          "kind": "schema",
          "description": "A schema contract resolves to the declared version and retains its repository identity.",
          "expected": { "state": "resolved", "count": 2 },
          "observed": { "state": "resolved", "count": 2 },
          "evidenceRef": "fixture:w006-v0.1/atlas/schema",
          "reproducible": true
        },
        {
          "id": "atlas-missing-repository",
          "kind": "missing-repository",
          "description": "A missing optional repository remains visible and is not treated as an empty graph.",
          "expected": { "state": "unresolved", "count": 1 },
          "observed": { "state": "unresolved", "count": 1 },
          "evidenceRef": "fixture:w006-v0.1/atlas/missing-repository",
          "reproducible": true
        },
        {
          "id": "atlas-version-skew",
          "kind": "version-skew",
          "description": "A request for an unavailable package version remains unresolved with the available version recorded.",
          "expected": { "state": "unresolved", "count": 1 },
          "observed": { "state": "unresolved", "count": 1 },
          "evidenceRef": "fixture:w006-v0.1/atlas/version-skew",
          "reproducible": true
        },
        {
          "id": "atlas-cross-boundary-change",
          "kind": "cross-boundary-change",
          "description": "A package-to-service contract change replays through the declared cross-repository boundary.",
          "expected": { "state": "replayed", "count": 2 },
          "observed": { "state": "replayed", "count": 2 },
          "evidenceRef": "fixture:w006-v0.1/atlas/cross-boundary-change",
          "reproducible": true
        }
      ],
      "metrics": {
        "resolution": {
          "truePositives": 10,
          "falsePositives": 1,
          "falseNegatives": 1,
          "precision": 0.9090909090909091,
          "recall": 0.9090909090909091
        },
        "unknownCoverage": {
          "knownRecords": 10,
          "unknownRecords": 2,
          "totalRecords": 12,
          "rate": 0.16666666666666666
        },
        "identityStability": {
          "stableIdentities": 18,
          "changedIdentities": 1,
          "ambiguousIdentities": 1,
          "comparedIdentities": 20,
          "stability": 0.9
        },
        "incrementalPerformance": {
          "coldDurationMs": 1200,
          "warmDurationMs": 400,
          "speedup": 3,
          "totalUnits": 6,
          "changedUnits": 1,
          "recomputedUnits": 1,
          "reusedUnits": 5
        },
        "reviewerUsefulness": {
          "status": "not-observed",
          "taskCount": 0,
          "completedTasks": 0,
          "completionRate": null,
          "reason": "No external reviewer study is retained; technical replay cannot stand in for reviewer usefulness."
        },
        "privacy": {
          "status": "pass",
          "network": false,
          "hiddenTelemetry": false,
          "sourceBodiesIncluded": false,
          "findingCount": 2,
          "findings": [
            "Only aggregate counts, digests, and public references are retained.",
            "The missing repository is explicit without attempting acquisition."
          ]
        }
      },
      "limitations": [
        "The public record is pinned metadata and aggregate output, not a live repository checkout.",
        "No reviewer usefulness or population-level accuracy claim is made."
      ]
    },
    {
      "id": "beacon",
      "title": "Beacon sanitized service portfolio",
      "source": {
        "kind": "sanitized-record",
        "reference": "sanitized://cartograph/beacon-portfolio",
        "revision": "d5e6f7a8",
        "license": "Apache-2.0",
        "sourceBodiesIncluded": false
      },
      "sizeTier": "medium",
      "declaredSize": {
        "repositories": 4,
        "graphNodes": 60,
        "graphEdges": 83
      },
      "repositories": [
        {
          "id": "beacon-core",
          "role": "package",
          "status": "present",
          "identity": "sanitized://beacon/core",
          "version": "2.4.0",
          "revision": "e6f7a8b9",
          "graphNodes": 24,
          "graphEdges": 34,
          "sourceBodiesIncluded": false
        },
        {
          "id": "beacon-api",
          "role": "service",
          "status": "present",
          "identity": "sanitized://beacon/api",
          "version": "4.0.0",
          "revision": "f7a8b9c0",
          "graphNodes": 22,
          "graphEdges": 31,
          "sourceBodiesIncluded": false
        },
        {
          "id": "beacon-schema",
          "role": "schema",
          "status": "present",
          "identity": "sanitized://beacon/schema",
          "version": "5.2.0",
          "revision": "a8b9c0d1",
          "graphNodes": 14,
          "graphEdges": 18,
          "sourceBodiesIncluded": false
        },
        {
          "id": "beacon-archive",
          "role": "service",
          "status": "missing",
          "identity": "sanitized://beacon/archive",
          "version": null,
          "revision": null,
          "graphNodes": 0,
          "graphEdges": 0,
          "sourceBodiesIncluded": false
        }
      ],
      "scenarios": [
        {
          "id": "beacon-package",
          "kind": "package",
          "description": "A package dependency resolves through an alias while preserving the sanitized origin namespace.",
          "expected": { "state": "resolved", "count": 6 },
          "observed": { "state": "resolved", "count": 6 },
          "evidenceRef": "fixture:w006-v0.1/beacon/package",
          "reproducible": true
        },
        {
          "id": "beacon-service",
          "kind": "service",
          "description": "A service declaration resolves across a sanitized repository boundary.",
          "expected": { "state": "resolved", "count": 5 },
          "observed": { "state": "resolved", "count": 5 },